content,label
" great part-time summer job ! * * * * * * * * * * * * * * * display boxes credit applications need place small owner-operated stores area . here is : 1 . introduce yourself store owner manager . 2 . our 90 % effective script tells little display box save customers hundreds dollars , drawing card business , $ 5 . 00 $ 15 . 00 every app sent . 3 . spot counter , place box , nothing need done , need is name address company send commission checks . compensaation $ 10 every box place . becoming representative earn commission $ 10 each application came store . is course much profitable plan , pay months years small effort . call 1-888 - 703-5390 code 3 24 hours receive details ! ! * * * * * * * * * * * * * * * * * * * * * * * * * * * * * * * * * * * * * * * * * * * * * * * * * * * * * * * * * * * * * * * * * * * * * * * * * * * * * * * * * * * * * * * * * * * * * * * * * * * * * * * * * * * * * * * * * * * * * * * * * * * * * * * * * * * * * * * * * * * * * * * * * * * * * * * * * * * * * * * * * * * * * * * * * * * * * * * * * * * * * * * removed our mailing list , type : b2998 @ hotmail . com ( : ) area ( remove ) subject area e - mail send . * * * * * * * * * * * * * * * * * * * * * * * * * * * * * * * * * * * * * * * * * * * * * * * * * * * * * * * * * * * * * * * * * * * * * * * * * * * * * * * * * * * * * * * * * * * * * * * * * * * * * * * * * * * * * * * * * * * * * * * * * * * * * * * * * * * * ",0
" auto insurance rates too high ? dear nlpeople , ' m sure ' ll agree auto insurance costs too much . even driving record , "" routine "" rate increases drive costs through roof . discovered many sign excellent company gives amazingly low rates . are half most rates ' ve found shopping around insurance southern california . most either qualify friend qualifies love . n't qualify , another company operates several western states is cheaper many companies claim "" lowest rates available . "" send $ 2 cash : pva 1257 n kenmore ave # 2 los angeles , ca 90029 fold piece paper e - mail address rush information right away . prefer hardcopy printout , enclose self-addressed , stamped envelope . p . s . bonus include two mechanic 's tips save lots certain common repair job , quick easy check general condition engine . n't found repair manuals books before . are great home mechanics ! ",0
" advertsing ? legal ! ! offer smtp ! ! ! ! great news advertisers bulkers ! ! ! ! our server send own mail ! ! ! ! ! never loose dial again ! ! ! never relay steal services again ! ! ! between 100k 200k hour ! ! our bandwidth ! ! $ 250 . 00 month $ 250 . 00 setup * * are company offering service today , here years . ask our customers ! ! * * 9 spots open ! ! ! ! * * express mail server * * special * * $ 150 . 00 * * call 1-800 - 298-7863 order demo today ! ! mail programs fresh 20 million + email addresses cd $ 90 . 00 3 stealth mass mailers unlock codes $ 250 . 00 gold rush $ 300 . 00 email adressee extractor $ 100 . 00 caller id $ 100 . 00 bulk mate list manager $ 129 . 00 desk top server 98 $ 300 . 00 mx lookup $ 185 . 00 much bulk friendly web hosting foreign backbone $ 150 . 00 month , 2 page bulk friendly web hosting $ 100 . 00 month , call great rate 8 . 9 cents long distance , even 800 / 888 numbers ! ! 14 . 9 cents minute calling cards ( prepaid ) earn money too ! ! ! 800 voice mail unlimited calls , $ 60 . 00 month ! ! ! ! ! please leave information item are calling . thank . need advertise product service ? ! ! are already paying someone , call us bet beat . our fees usually start $ 395 . 00 1 . 2 million , even lower rates . advertise products services ! ! ! ! please call us rates ! ! ! ! ! excellant rates ! ! ! ! worldwide marketing inc , 3807 n oak dr tampa , fl 33611 1-888 - 398-9866 please leave message ! ! ! 7 om ",0
" free trial membership latest adult technology ! ! ! brand xxx adult site free trial membership please visit latest live video conferencing . 1000 channels hardcore ! ! live rooms ! ! ! young dancers ! ! ! large picture gallery ! thousands pictures ! ! visit our site great experience . http : / / www . sexxxybodies . com # # # # # # # # # # # # # # # # # # # # # # # # # # # # # # # # # # # # # # # # # # # # # # # # message is sent compliance e-mail bill : section 301 * # # # # # # # # # # # # # # # # # # # # # # # # # # # # # # # # # # # # # # # # # # # # # # # # # # # # # # # # # # # # # # # # # # # # # # # # # # # # # # # # # # # # # # # # # # # # # * "" per section 301 , paragraph ( ) ( 2 ) ( c ) s . 1618 , further transmissions sender email stopped cost sending reply email address word "" remove "" subject line . "" # # # # # # # # # # # # # # # # # # # # # # # # # # # # # # # # # # # # # # # # # # # # # * * * * * * * * * * * * * * * * * * * * * * * * * * * * * * * * * * * * * * * * * * * * * * * * * * * * * * * * * * * * * * * * * * * * * * * * * * * * * * * * oa nuko64 @ msn . com ",0
" market millions , try free message complies proposed united states federal requirements commercial email bill , s . 1618 section 301 . additional info : http : / / thomas . loc . gov / , search "" s . 1618 . es "" section 301 . required sender information : networks internet tools , waterford , wi , 534-7409 per section 301 , paragraph ( ) ( 2 ) ( c ) s . 1618 , further transmissions sender email stopped cost replying message subject "" remove "" - - - - - - - - - - - - - - - - - - - - - - dear fellow entrepreneur , recent posting presence certain areas web lead believe interested promoting product service internet . need proper tools . fingertips power reach tens millions . advantage unwise . proper software assist taking online business venture unbelievable level success targeting reaching vast audience . does much set storefront internet selection items help : http : / / net-tools . net try software evaluation basis . thank luck venture . best regards , sales @ net-tools . net http : / / net-tools . net * * * * * * * * * * * * * * * * * * remove requests * * * * * * * * * * * * * * * * * * * ` \ | | | / wishing best ! ( @ @ ) ooo _ ( _ ) _ ooo _ _ _ _ _ _ _ _ _ _ _ _ _ _ _ _ _ _ _ _ _ _ _ _ _ _ _ _ _ _ _ _ _ _ _ _ _ | _ _ _ _ _ | _ _ _ _ _ | _ _ _ _ _ | _ _ _ _ _ | _ _ _ _ _ | _ _ _ _ _ | _ _ _ _ _ | _ _ _ | _ _ _ _ | _ _ _ _ _ | _ _ _ _ _ | _ _ _ _ _ | _ _ _ _ _ | _ _ _ _ _ | _ _ _ _ _ | _ _ _ _ _ _ _ _ _ | _ _ _ _ _ please pardon intrusion _ | _ _ _ _ | _ _ _ _ _ removed reply subject : "" remove "" permanently removed future mailings . ",0
" lists software worldwide order form : addresses are fresh cleaned against international remove lists best results minimum irritation those wish recieve unsolicited mail . discs details web sites usefull mailing programs related products available net . many mailer programs bypass isp send mail direct recipient dont need expensive "" bulk-friendly "" isp . disc supplied free mailing program , best started dont one . prices are quoted uk pound sterling / us dollars are fully inclusive postage packing 1 , 000 , 000 email addresses @ 15 / $ 35 [ ] 2 , 000 , 000 email addresses @ 29 / $ 59 [ ] 3 , 000 , 000 email addresses @ 42 / $ 80 [ ] 4 , 000 , 000 email addresses @ 54 / $ 102 [ ] 5 , 000 , 000 email addresses @ 65 / $ 120 [ ] 6 , 000 , 000 email addresses @ 75 / $ 137 [ ] 7 , 000 , 000 email addresses @ 84 / $ 152 [ ] 8 , 000 , 000 email addresses @ 92 / $ 163 [ ] 9 , 000 , 000 email addresses @ 99 / $ 178 [ ] cd [ ] . zip files email [ ] email address lists are sent text documents cd email . zip files opened most word processing packages imported most data bases bulk email software . order outside uk send either cheques own currency ( amount calcuated prices us dollars pound sterling , are unsure work exchange rates bank work ask . need ask $ xx dollars is currency send much ) order tick number addresses wish purchase tick disc type wish receive . fill details below post order together payment ( cheques own currency us dollar travellers cheques please ) made payable prophoto : prophoto mail , po box 447 , doman road , camberley , surrey , england gu15 3xd . email addresses dispatched soon payment has cleared ( normally 5 days ) . name : _ _ _ _ _ _ _ _ _ _ _ _ _ _ _ _ _ _ _ _ _ _ _ _ _ _ address : _ _ _ _ _ _ _ _ _ _ _ _ _ _ _ _ _ _ _ _ _ _ _ _ _ _ _ _ _ _ _ _ _ _ _ _ _ _ _ _ _ _ _ _ _ _ _ _ _ _ _ _ _ _ _ _ _ _ _ _ _ _ _ _ _ _ _ _ _ _ _ _ _ _ _ _ _ _ _ _ _ _ _ _ _ _ _ _ _ _ _ _ _ _ _ _ _ _ _ _ _ _ _ _ _ _ _ _ _ _ _ _ _ _ _ _ _ _ country : _ _ _ _ _ _ _ _ _ _ _ _ _ _ _ _ _ _ _ _ _ _ _ _ post / zip code : _ _ _ _ _ _ _ _ _ _ _ _ _ _ _ _ _ _ _ _ email address : _ _ _ _ _ _ _ _ _ _ _ _ _ _ _ _ _ _ _ enclose cheque value ( enter amount ) _ _ _ _ _ _ _ _ _ _ _ _ _ _ _ _ _ _ _ _ _ _ _ _ currency is payment ? ( country / currency ) _ _ _ _ _ _ _ _ _ _ _ _ _ _ _ _ _ _ _ _ puchased date : 1xt ",0
 zero down internet opportunity ! $ 0 down internet opportunity * complete computer system * e - com web site package * tutorials - ' ll teach * earn big while learn info : 520-615 - 3253 ,0
" re : free ! hello , are offering fantastic 100 % free access most famous adult site world . visit url free access . bullshit . ! ! ! http : / / www . sexplosion . com / / thepussy / are able access , try our mirror site : http : / / www . geocities . com / southbeach / island / 2325 / fun . pussyman . ",0
"  comes porn , site does n't mess around . dish mouthful , quick easy . dive 700 + xxx - rated strip shows video feeds plus thousands pics including teens , orgies , asians , amateurs , exclusive photo shoots , . try our ' cyberfolds ' section where massage girl live screen watch hidden peep cam ! want try , 's worth , signup entire week $ 3 . 95 . link below http : / / 209 . 125 . 202 . 39 / a001 / index . html over 18 ' s access site ",0
" even steal identity ! are being investigated ? has personal credit information been stolen ? has someone assumed identity ? locate old friend , relative , military buddy sweetheart ? want person 's assets collect debt judgement ? check person 's criminal record before renting space giving employment ? fix credit bureau report , create identity even disappear ? are going surgery ? many malpractice suits been filed against doctor ? learn plus much , much our brand 45 page report "" internet sleuth "" ! learn internet tools resources are used investigate , relatives , friends , neighbors , enemies , employees anyone else ! thousands internet locations , credit , social security , current past employment , driving records , criminal records , medical information , military records , addresses , phone numbers , immigration , divorce , labor criminal laws ! sources missing children parents , hazardous waste sites , freedom information act information searches , skip tracing backround checks prospective dates , brides grooms , employees , renters , vendors , clients competitors ! learn where surveillance spy devices , private mail forwarding annonymous email forwarding sites , search copyrights , patents court cases assets untraceable ! show copies credit reports , adoption databases , information drugs , poisons share government programs benefits ! information using internet search engines ? answer is maybe lucky want spend many hours going through 25 , 000 plus hits per subject ! our staff spent hundreds hours many thousands dollars compiling information ! silver platter less twenty bucks during special email promotion ! frequently hear over media , television , radio , newspapers , personal information is being used , traded sold over internet . . . usually without permission knowledge . our report show is done ! ! ! old romantic flame . . . telephone , address email information almost anyone . . . even unlisted phone numbers ? family "" tree "" ? teach turn years work hours fun ! military ? check army , navy , air force marine records . extensive vietnamese war records , mia info , much ! looking job ? job are seeking . . . even another state another country ! teach ! looking love interest spouse even sex partner ? show where fast results ! want up-to - the-minute health medical information ? learn cure fears phoebias , latest drugs treatments almost ailment desease drug companies themselves universities center desease control . want learn most effective loose weight ? 's here our report ! believe information compiled available compile without knowledge permission must order "" internet sleuth report "" immediately ! our "" internet sleuth report "" is normally sold direct mail $ 39 . 95 soon book stores $ 29 . 95 . however , generate publicity "" word "" are making 10 day email special offer our complete 45 page report $ 19 . 95 plus $ 3 shipping handling [ total $ 22 . 95 ] . sold our 10 day money back guarantee ! is biggest bargain internet information great power ! really change life positive . order ! complete 45 page "" internet sleuth report "" $ 19 . 95 plus $ 3 shipping handling - total $ 22 . 95 . shipped plain wrapper first class mail . add $ 5 priority mail delivery . add $ 20 overnight express ! accept visa , mastercard , american express discover . accept check phone fax . order phone 9 am 10 pm [ ny ] phoning [ 718 ] 287-3800 order fax 24 hours per day phoning our fax line [ 718 ] 462-5920 . fax credit card information check email order - hit reply keyboard send email our special email address below : bernadette38 @ juno . com [ note : order email receive email confirmation within 24 hours , please phone our office 718-287 - 3800 ] order mail sending $ 22 . 95 cash , check , money order major credit card [ visa , mastercard , american express discover ] tcps , inc . 4718 18th ave . suite 135 brooklyn , ny 11204 checks & money orders payable tcps , inc . york state residents please add $ 1 . 70 sales tax following order form is convenience ! mail , fax email ! . . . . . . . . . . . . . . . . . . . . . . . . . . . . . . . . . . . . . . . . . . . . . . . . . . . . . . . . . . . . . . . . . . . . . . . . . . . . . . . . . . . . . . . . . . . . . . . . . . . . . . . . . . . . . please ship _ _ _ _ _ _ _ _ copies internet sleuth report $ 19 . 95 each plus $ 3 . 00 shipping handling [ $ 22 . 95 ] signature _ _ _ _ _ _ _ _ _ _ _ _ _ _ _ _ _ _ _ _ _ _ _ _ _ _ _ _ _ _ _ _ _ _ _ _ _ _ _ _ _ _ _ _ _ _ credit card # _ _ _ _ _ _ _ _ _ _ _ _ _ _ _ _ _ _ _ _ _ _ _ _ _ _ _ _ exp date _ _ _ _ _ _ ship : name _ _ _ _ _ _ _ _ _ _ _ _ _ _ _ _ _ _ _ _ _ _ _ _ _ _ _ _ _ _ _ _ _ _ _ _ _ _ _ _ _ address _ _ _ _ _ _ _ _ _ _ _ _ _ _ _ _ _ _ _ _ _ _ _ _ _ _ _ _ _ _ _ _ _ _ _ _ _ _ _ _ _ _ _ _ _ _ _ _ city _ _ _ _ _ _ _ _ _ _ _ _ _ _ _ _ _ _ _ _ _ _ _ _ state _ _ _ _ _ _ _ _ _ _ _ zip _ _ _ _ _ _ _ _ area code home phone [ ] _ _ _ _ _ _ _ _ _ _ _ _ _ _ _ _ _ _ _ _ _ _ _ _ _ _ _ fax # [ ] _ _ _ _ _ _ _ _ _ _ _ _ _ _ _ _ _ _ _ _ _ _ _ _ _ _ _ _ _ _ _ _ _ _ _ _ _ _ _ _ _ _ _ _ _ _ email address _ _ _ _ _ _ _ _ _ _ _ _ _ _ _ _ _ _ _ _ _ _ _ _ _ _ _ _ _ _ _ _ _ _ _ _ _ _ _ _ _ _ _ remove name our mailing list , send us email remove subject line . is one offer hear us again ! tcps , inc . , 4718 18th ave . , suite 135 , brooklyn , ny 11204 office [ 718 ] 287-3800 fax [ 718 ] 462-5920 24 hours [ 9am 10pm ny ] [ c ] copyright 1998 tcps , inc . rights reserved . ",0
 wanted ! home product assemblers ! looking home product assemblers ! ! assemble products home & paid ! choose own hours ! own boss ! easy work ! excellent pay ! earn hundreds dollars weekly ! here are few examples work choose : wooden products - $ 220 . 00 weekly ! hair accessories - $ 320 . 00 weekly ! holiday crafts - $ 270 . 00 weekly ! beaded accessories - $ 350 . 00 weekly ! . . . . . . . plus many others . are over 75 companies choose ! why enjoy benefits freedom home assembly work ! call . . . . . toll free ( 24 hour recording ) 1-800 - 600-0343 office extension # 2425 . usa publishing co . p . o . box 8950 rocky mount nc 27804 name _ _ _ _ _ _ _ _ _ _ _ _ _ _ _ _ _ _ _ _ _ _ _ _ _ _ _ _ _ _ _ _ _ _ _ _ _ _ _ _ _ _ _ address _ _ _ _ _ _ _ _ _ _ _ _ _ _ _ _ _ _ _ _ _ _ _ _ _ _ _ _ _ _ _ _ _ _ _ _ _ _ _ _ _ _ _ city & state _ _ _ _ _ _ _ _ _ _ _ _ _ _ _ _ _ _ _ _ _ _ _ _ _ _ _ _ _ _ _ _ _ _ _ _ _ _ _ _ _ _ _ q 04627caa ,0
" secrets noveau rich stumbled upon something real life changing ! work full part pace - - home office . mlm ' scam ' . job tour prospects through turnkey system utilizing strong support teams allow access understand powerful opportunities available through association . personal selling ! ! complete training team support is fingertips - - immediately ! $ 1 , 000 . 00 $ 5 , 000 . 00 per week is typical most associates within thirty days ! turnkey leads are available ! ! * * * * * * * * * * * * * * * * * * * * * * * * * * * * * * * * * * * * * * * * * * * * * * * * * * * * * * * * * * * * * * * * * * * * * * * * * * * * * * * * * * * * * * * * been looking home-based business opportunity , lucky day ! over twenty thousands individuals , like-minded entrepreneurs , intent upon making profits , within four years , turned one-time investment powerful money making operation ! many are making excess $ 50 , 000 . 00 per month . ask speak hear story ! growth progression within association allow travel exotic places , learn secrets wealthy - - money keep , hands-on education many wealth building opportunities . is right ? are ready ' roll sleeves work ? ' are click link below contact = = = = = = = = = = = = = = = = = = = = = = = = = = = = = = = = = = click here = = = = = = > > > click here put word "" succeed "" subject field plus information below click send . - - - - - - - - - - - - - - - - - - - - - - - - - - - - - - - - - - - - - - - - - - - - - - - - - - - - - - please include following : without information contacted - - - - - - - - - - - - - - - - - - - - - - - - - - - - - - - - - - - - - - - - - - - - - - - - - - - - - - name home work phone number best contact = = = = = = = = = = = = = = = = = = = = = = = = = = = = = = = = = = = = = = = = = = = = = = = = = = = = = = = = = = = = = remove mailing list click link below : click here put words "" remove "" subject field click send . ",0
" does debt-free sound ? sounds , help attain goal . qualifying being debt-free is fingertips are long distance calls travel plans arrange . american capital save huge amount money monthly payments taxes , cost . free loan evaluation : http : / / 208 . 26 . 207 . 79 / moneyhelp / 175 . html are american capital mortgage services , specialize helping homeowners establish one easy low monthly payment added benefit needing equity home . american capital is constantly working lenders throughout u . s . provide best interest rate possible . number different companies work is cost ever . are simply referral agency . lose , why shot better situation save yourself hundreds per month . cash pocket usually within 7-14 days . did loan is tax deductible ? ask is name , address , phone number e-mail address . rest is optional . representative personally call answer detailed questions . free loan evaluation please , visit our website clicking here : http : / / 208 . 26 . 207 . 79 / moneyhelp / 175 . html type : http : / / 208 . 26 . 207 . 79 / moneyhelp / 175 . html browser . put us test . help . kindest regards * * * * * * * * * * * * * * * * * * * * * * * * * * * * * * * * * * * * * * * * * * * * * * * * * * * * * * * * * * * * * * * * * * * * * * * * * * * * * message complies proposed united states federal requirements commercial email washington state commercial email bill . additional information : http : / / www . senate . gov / ~ murkowski / commercialemail / emailamendtext . html washington state commercial email bill : http : / / ww . wa . gov / wwweb / ago / junkemail / required sender information : american capital ft . thomas , ky 41075 thall14 @ sprynet . com 1-212 - 796-6549 wish removed mailing list , : http : / / www . remove-list . com ",0
" ` hello ! our naughty little city made especially adults http : / / 208 . 26 . 207 . 98 / freeweek / enter . html once here , won't want leave ! ",0
" attract women ! ! ( 30740 ) attract women ! ! ! nature 's secret weapon . . . . pheromones invisible , odorless , undetectable , unknowingly inhaled adult woman , androstenone pheromone concentrate unblocks restraints unleashes raw animal sex drive ! scientists isolated natural human male pheromone attractants are available , legally , u . s . ! power androstenone has been featured hardcopy , 20 / 20 , dateline , articles penthouse , playboy , chic , swank , vogue , omni , discovery numerous medical journals , television shows newspapers n . y . times l . . times . five years , been researching marketing pheromone products . sold thousands bottles . receive letters praise daily , men across country ! every wear androstenone pheromone concentrate , send natural chemical signal sex appeal women compel towards , irresistible why . attract women : pheromones miraculously increase sexual attractiveness women . allow meet women ever imagined ! even after small application androstenone pheromone concentrate , notice women suddenly making eye contact , flirting , even walking introducing themselves ! arrouse spouse existing sexual partner : start passion between mate re-energize existing relationship ! androstenone rejuvenate passion ! pheromone stimulation restores attraction felt first met ! androstenone is known true male human pheromone tested showing positive vno response women , proven again attract women . limited , are offering one bottle androstenone pheromone concentrate $ 19 . 95 ! . . . thats right , $ 19 . 95 ! money back guarantee : n't immediately notice drastic increase amount women approaching , send remainder androstenone pheromone concentrate back full refund ! 1 bottle impulse . . . $ 19 . 95 buy 2 bottles receive 3rd bottle free ! orders shipped day are received . items are shipped discreet unmarked packaging . order check credit card ( credit card discreetly billed . ) , visit our website : http : / / 208 . 166 . 10 . 7 / thera / index . htm web access , place order sending check money order ( total amount + $ 4 . 95 s + h ) : amazing products , inc . 1334 e . chandler bl . # 5-a11 phoenix , az 85048 * * * * * * * * * * * * * * * * * * * * * * * * * * * * * 84822 ",0
" are serious . . . help retire 2 3 years ! is money why waste yours . . . . . . serious retiring 2 3 years money u need live life u always wanted yes , work hard help regardless ' re current age financial situation please are serious ( curious ) call number today 24 hour recorded message 1-800 - 995-0796 ext . 8511 c # ed ",0
